{
  "schemaVersion": 1,
  "signalId": "deepseek-v4-flash-usage-rates",
  "observedAt": "2026-08-14T04:05:24.543Z",
  "source": {
    "url": "https://api-docs.deepseek.com/quick_start/pricing/",
    "fetchedAt": "2026-08-14T04:05:24.500Z",
    "contentHash": "sha256:1a80574b5e31ebb79b96ef0d0042189a39cf503840b5897ba692cce56605d875"
  },
  "values": [
    {
      "name": "input-price-cache-hit",
      "unit": "per-1m-tokens",
      "currency": "USD",
      "statements": [
        {
          "value": 0.0028,
          "note": "through 16:00 UTC on August 16, 2026"
        },
        {
          "value": 0.007,
          "note": "off-peak from 16:00 UTC on August 16, 2026"
        },
        {
          "value": 0.014,
          "note": "peak (01:00 - 04:00 and 06:00 - 10:00 UTC (all other hours are off-peak)) from 16:00 UTC on August 16, 2026"
        }
      ]
    },
    {
      "name": "input-price-cache-miss",
      "unit": "per-1m-tokens",
      "currency": "USD",
      "statements": [
        {
          "value": 0.14,
          "note": "through 16:00 UTC on August 16, 2026"
        },
        {
          "value": 0.22,
          "note": "off-peak from 16:00 UTC on August 16, 2026"
        },
        {
          "value": 0.44,
          "note": "peak (01:00 - 04:00 and 06:00 - 10:00 UTC (all other hours are off-peak)) from 16:00 UTC on August 16, 2026"
        }
      ]
    },
    {
      "name": "output-price",
      "unit": "per-1m-tokens",
      "currency": "USD",
      "statements": [
        {
          "value": 0.28,
          "note": "through 16:00 UTC on August 16, 2026"
        },
        {
          "value": 0.66,
          "note": "off-peak from 16:00 UTC on August 16, 2026"
        },
        {
          "value": 1.32,
          "note": "peak (01:00 - 04:00 and 06:00 - 10:00 UTC (all other hours are off-peak)) from 16:00 UTC on August 16, 2026"
        }
      ]
    }
  ]
}
